Profession,"Emploi <br><i style=""font-size:80%;"">Février 2025</i>","Salaire médian <br><i style=""font-size:80%;"">2021</i>"
"Professionnels/professionnelles en publicité, en marketing et en relations publiques ^CNP 11202^",1000.0,51200.0
"Développeurs/développeuses et programmeurs/programmeuses de logiciels ^<span style=""text-decoration: underline;"">[CNP 21232](https://etalentcanada.ca/fr/carrieres/developpeursdeveloppeuses-et-programmeursprogrammeuses-de-logiciels)</span>^",600.0,60000.0
"Agents/agentes de soutien aux utilisateurs ^<span style=""text-decoration: underline;"">[CNP 22221](https://etalentcanada.ca/fr/carrieres/agentsagentes-de-soutien-aux-utilisateurs)</span>^",500.0,38000.0
"Spécialistes en informatique ^<span style=""text-decoration: underline;"">[CNP 21222](https://etalentcanada.ca/fr/carrieres/specialistes-en-informatique)</span>^",400.0,72500.0
"Développeurs/développeuses et programmeurs/programmeuses de systèmes informatiques ^<span style=""text-decoration: underline;"">[CNP 21230](https://etalentcanada.ca/fr/carrieres/developpeursdeveloppeuses-et-programmeursprogrammeuses-de-systemes-informatiques)</span>^",400.0,59600.0
"Designers graphiques et illustrateurs/illustratrices ^<span style=""text-decoration: underline;"">[CNP 52120](https://etalentcanada.ca/fr/carrieres/designers-graphiques-et-illustrateursillustratrices)</span>^",400.0,36000.0
"<i style=""font-size:80%;""><sup>†</sup></i> Directeurs/directrices de la publicité, du marketing et des relations publiques ^CNP 10022^",300.0,55200.0
"Gestionnaires des systèmes informatiques ^<span style=""text-decoration: underline;"">[CNP 20012](https://etalentcanada.ca/fr/carrieres/gestionnaires-des-systemes-informatiques)</span>^",300.0,93000.0
"Spécialistes des systèmes commerciaux ^<span style=""text-decoration: underline;"">[CNP 21221](https://etalentcanada.ca/fr/carrieres/specialistes-des-systemes-commerciaux)</span>^",200.0,67000.0
"Analystes de bases de données et administrateurs/administratrices de données ^<span style=""text-decoration: underline;"">[CNP 21223](https://etalentcanada.ca/fr/carrieres/analystes-de-bases-de-donnees-et-administrateursadministratrices-de-donnees)</span>^",200.0,67000.0
